{
  "atlas_id": "spa.model.z13_18_sme",
  "espmap": {
    "commit": "41a989d",
    "version": "0.2.1"
  },
  "inchikey": "NQNKJOBSFCTOFM-SREVYHEPSA-N",
  "members": [
    {
      "analysis_key": "80a4b4f0c30a0f018594bc73d9abd83a3adb2ffd",
      "conformer": "conf_00",
      "folded": false,
      "npz": "conf_00.npz",
      "npz_sha256": "fa697d4058c9d5eb7a2eda0a1c7f7cfa8c53d683a5fc027524957553d6528ab7",
      "record": "conformers/conf_00.json",
      "record_sha256": "4b2ade4b74553c191d23c1d16577dc10c428dfc6eb28bd6fc01f94de3e49a398",
      "rg_angstrom": 5.2
    }
  ],
  "protocol": "b3lyp_def2-svp_gas_espmap-v0.2.1",
  "schema": "spa.espmap_ensemble/0",
  "selection": {
    "method": "fixture: lowest MMFF conformers",
    "notes": "folded: Rg below the extended median (fixture)"
  },
  "settings": {
    "basis": "def2-svp",
    "solvent": null,
    "solvent_esp": null,
    "xc": "b3lyp"
  },
  "smiles": "CCCC/C=C\\CCCCCCCCCCCC(=O)SC"
}
